{
  "part": "AION Builder",
  "version": "v2",
  "inputs": [
    {
      "name": "the 49GAION Standard (pinned version)",
      "format": "versioned file in git (ID + version)"
    },
    {
      "name": "the 49GAION Library (pinned version)",
      "format": "versioned file in git (ID + version)"
    },
    {
      "name": "the organisation's intake and Configuration",
      "format": "versioned file in git (ID + version)"
    }
  ],
  "outputs": [
    {
      "name": "an [ORG]AION record (spec/schemas/org-aion-record.schema.json), including its delivery test",
      "format": "versioned file in git (ID + version)"
    },
    {
      "name": "the [ORG]AION's definitions (Standard, Protocol, Library, blueprints, cards, Configuration)",
      "format": "versioned file in git (ID + version)"
    },
    {
      "name": "Library harvest: blueprints of capabilities not yet in the 49GAION Library, generalised and tested",
      "format": "versioned file in git (ID + version)"
    }
  ],
  "test": {
    "id": "TEST-AION-BUILDER",
    "version": "v2"
  },
  "status": "DRAFT"
}
