{
  "part": "49GAION Source Lifecycle",
  "version": "v3",
  "inputs": [
    {
      "name": "documents and files of any format, and existing collections of them, from the organisation or from its other systems",
      "format": "file, received through the Input socket"
    },
    {
      "name": "a contributor's own words, by text, chat or voice",
      "format": "conversation, recorded only after the contributor approves a preview of the exact text"
    },
    {
      "name": "a request from a connected part, including a request for a source that is missing",
      "format": "Work Item (ID + version), received through the tool gateway"
    },
    {
      "name": "needs requests from a connected design stage, one thing and one decision per row, each pass with its report of what is still missing",
      "format": "Work Item sub-items (ID + version) under the published sockets contract, received through the tool gateway"
    },
    {
      "name": "filings of a design stage, only of its own origin kind (operating model; process and position design; delivery and implementation) and design report, on behalf of a named HOAC position that holds a current contributor agreement",
      "format": "content-addressed source, received through the tool gateway within the stage's write scope"
    },
    {
      "name": "exports of records of the work as it runs, only as the organisation's own projection by role-type and process, after an impact assessment and the data-protection decision (HF-17); an export that still says who did the work is refused",
      "format": "source, recorded as origin kind export with its date"
    }
  ],
  "outputs": [
    {
      "name": "the organisation's sources: registered, referenced, classified and fixed, each with its status",
      "format": "versioned record (ID + version + hash)"
    },
    {
      "name": "answers to a connected part, by reference only: held or not held, within the scope approved by the [ORG]HOAC-ACS seat that [ORG]AIOC-SL is accountable to",
      "format": "Work Item (ID + version), sent through the tool gateway"
    },
    {
      "name": "what the organisation is missing, and the state of each request for a missing source",
      "format": "versioned record (ID + version)"
    },
    {
      "name": "needs answers by reference, each routed to and answered by a position, never a named person; a row of a listed type decided only with its signature at the tool gateway",
      "format": "needs answer under the published sockets contract, sent through the tool gateway"
    },
    {
      "name": "notices to a connected part of every revocation, narrowing, reclassification or supersession that affects a reference it read, naming each reference and version, never the content",
      "format": "Work Item (ID + version), sent through the tool gateway"
    },
    {
      "name": "the organisation dictionary, its own terms with their definitions and sources, served by reference to every design stage; and the essentials checklist, flagging what the organisation's sources should hold, shown beside a Design Request when it is put for approval; never drafted for the owner",
      "format": "versioned source (dictionary) and versioned gap list, by reference"
    }
  ],
  "test": {
    "id": "TEST-SOURCE-LIFECYCLE",
    "version": "v3",
    "location": "library/cards/README.md",
    "last_result": "NOT_RUN"
  },
  "status": "DRAFT"
}
